Sheet: Sheet1
A2: My Data
A4: Items A | B4: Items B | C4: Items C | D4: Items D | E4: Items E | F4: Items F | G4: Items G | H4: Items H
A5: 12 | B5: 23 | C5: 33 | D5: 66 | E5: 11 | F5: 87 | G5: 99 | H5: 33
A6: 23 | B6: 22 | C6: 33 | D6: 77 | E6: 31 | F6: 22 | G6: 45 | H6: 56
A7: 34 | B7: 11 | C7: 12 | D7: 23 | E7: 22 | F7: 34 | G7: 11 | H7: 12
A8: 45 | B8: 43 | C8: 54 | D8: 88 | E8: 36 | F8: 45 | G8: 45 | H8: 37
A9: 65 | B9: 65 | C9: 65 | D9: 65 | E9: 13 | F9: 65 | G9: 9 | H9: 35
A10: 34 | B10: 22 | C10: 27 | D10: 22 | E10: 32 | F10: 23 | G10: 23 | H10: 32
A11: =SUM(R[-6]C:R[-1]C) -> 213 | B11: =SUM(R[-6]C:R[-1]C) -> 186 | C11: =SUM(R[-6]C:R[-1]C) -> 224 | D11: =SUM(R[-6]C:R[-1]C) -> 341 | E11: =SUM(R[-6]C:R[-1]C) -> 145 | F11: =SUM(R[-6]C:R[-1]C) -> 276 | G11: =SUM(R[-6]C:R[-1]C) -> 232 | H11: =SUM(R[-6]C:R[-1]C) -> 205

Sheet: Sheet2
A4: Sheet 2 Contents go here …

Sheet: Sheet3
A4: Sheet 3 Contents go here …